{
  "version": 1,
  "languages": [
    "en",
    "pt",
    "ru",
    "uk",
    "fr"
  ],
  "base": [
    {
      "id": "ext",
      "order": 0,
      "title": {
        "en": "Exterior",
        "pt": "Exterior",
        "ru": "Экстерьер",
        "uk": "Екстерʼєр",
        "fr": "Extérieur"
      },
      "children": [
        {
          "id": "ext.body",
          "order": 0,
          "title": {
            "en": "Body & paint",
            "pt": "Carroçaria e pintura",
            "ru": "Кузов и краска",
            "uk": "Кузов і фарба",
            "fr": "Carrosserie et peinture"
          },
          "items": [
            {
              "id": "ext.body.panels",
              "order": 0,
              "prompt": {
                "en": "Panel gaps even, no misalignment",
                "pt": "Folgas dos painéis uniformes, sem desalinhamento",
                "ru": "Зазоры кузова ровные, без перекосов",
                "uk": "Зазори кузова рівні, без перекосів",
                "fr": "Jeux de carrosserie réguliers, sans désalignement"
              }
            },
            {
              "id": "ext.body.paint",
              "order": 1,
              "prompt": {
                "en": "Paint consistent, no respray/overspray",
                "pt": "Pintura consistente, sem repintura",
                "ru": "Краска однородная, без перекраса",
                "uk": "Фарба однорідна, без перефарбування",
                "fr": "Peinture homogène, sans retouche ni surpulvérisation"
              }
            },
            {
              "id": "ext.body.rust",
              "order": 2,
              "prompt": {
                "en": "No rust or corrosion",
                "pt": "Sem ferrugem ou corrosão",
                "ru": "Нет ржавчины и коррозии",
                "uk": "Немає іржі та корозії",
                "fr": "Ni rouille ni corrosion"
              },
              "critical": true
            }
          ]
        },
        {
          "id": "ext.glass",
          "order": 1,
          "title": {
            "en": "Glass & lights",
            "pt": "Vidros e luzes",
            "ru": "Стёкла и фары",
            "uk": "Скло і фари",
            "fr": "Vitrage et éclairage"
          },
          "items": [
            {
              "id": "ext.glass.windscreen",
              "order": 0,
              "prompt": {
                "en": "Windscreen free of cracks/chips",
                "pt": "Para-brisas sem fissuras/lascas",
                "ru": "Лобовое без трещин и сколов",
                "uk": "Лобове без тріщин і сколів",
                "fr": "Pare-brise sans fissures ni impacts"
              }
            },
            {
              "id": "ext.glass.lights",
              "order": 1,
              "prompt": {
                "en": "All exterior lights work",
                "pt": "Todas as luzes exteriores funcionam",
                "ru": "Вся внешняя оптика работает",
                "uk": "Уся зовнішня оптика працює",
                "fr": "Tous les feux extérieurs fonctionnent"
              }
            }
          ]
        },
        {
          "id": "ext.tyres",
          "order": 2,
          "title": {
            "en": "Tyres & wheels",
            "pt": "Pneus e jantes",
            "ru": "Шины и диски",
            "uk": "Шини і диски",
            "fr": "Pneus et jantes"
          },
          "items": [
            {
              "id": "ext.tyres.tread",
              "order": 0,
              "prompt": {
                "en": "Tread depth adequate (≥1.6 mm; note mm per tyre)",
                "pt": "Profundidade do piso adequada (≥1,6 mm; anote mm por pneu)",
                "ru": "Глубина протектора достаточна (≥1,6 мм; укажите мм по колёсам)",
                "uk": "Глибина протектора достатня (≥1,6 мм; вкажіть мм по колесах)",
                "fr": "Profondeur de sculpture suffisante (≥1,6 mm ; noter les mm par pneu)"
              }
            },
            {
              "id": "ext.tyres.even",
              "order": 1,
              "prompt": {
                "en": "Tread worn evenly (across each tyre and between axles)",
                "pt": "Piso desgastado de forma uniforme (em cada pneu e entre eixos)",
                "ru": "Протектор изношен равномерно (по ширине и между осями)",
                "uk": "Протектор зношений рівномірно (по ширині та між осями)",
                "fr": "Usure régulière (sur chaque pneu et entre les essieux)"
              }
            },
            {
              "id": "ext.tyres.damage",
              "order": 2,
              "prompt": {
                "en": "No kerb/wheel damage, matching tyres",
                "pt": "Sem danos nas jantes, pneus iguais",
                "ru": "Диски без повреждений, шины одинаковые",
                "uk": "Диски без пошкоджень, шини однакові",
                "fr": "Jantes sans dommage, pneus identiques"
              }
            }
          ]
        }
      ]
    },
    {
      "id": "int",
      "order": 1,
      "title": {
        "en": "Interior",
        "pt": "Interior",
        "ru": "Салон",
        "uk": "Салон",
        "fr": "Intérieur"
      },
      "children": [
        {
          "id": "int.ctrl",
          "order": 0,
          "title": {
            "en": "Controls & electronics",
            "pt": "Comandos e eletrónica",
            "ru": "Управление и электроника",
            "uk": "Керування та електроніка",
            "fr": "Commandes et électronique"
          },
          "items": [
            {
              "id": "int.ctrl.warn",
              "order": 0,
              "prompt": {
                "en": "No dashboard warning lights",
                "pt": "Sem luzes de aviso no painel",
                "ru": "Нет ошибок на панели",
                "uk": "Немає помилок на панелі",
                "fr": "Aucun témoin d’alerte au tableau de bord"
              },
              "critical": true
            },
            {
              "id": "int.ctrl.ac",
              "order": 1,
              "prompt": {
                "en": "A/C, infotainment, windows work",
                "pt": "A/C, multimédia, vidros funcionam",
                "ru": "Климат, мультимедиа, стёкла работают",
                "uk": "Клімат, мультимедіа, скло працюють",
                "fr": "Clim, multimédia et vitres fonctionnent"
              }
            }
          ]
        },
        {
          "id": "int.seats",
          "order": 1,
          "title": {
            "en": "Seats & belts",
            "pt": "Bancos e cintos",
            "ru": "Сиденья и ремни",
            "uk": "Сидіння та ремені",
            "fr": "Sièges et ceintures"
          },
          "items": [
            {
              "id": "int.seats.wear",
              "order": 0,
              "prompt": {
                "en": "Wear consistent with mileage",
                "pt": "Desgaste consistente com a quilometragem",
                "ru": "Износ соответствует пробегу",
                "uk": "Знос відповідає пробігу",
                "fr": "Usure cohérente avec le kilométrage"
              }
            },
            {
              "id": "int.seats.belts",
              "order": 1,
              "prompt": {
                "en": "All seatbelts function",
                "pt": "Todos os cintos funcionam",
                "ru": "Все ремни работают",
                "uk": "Усі ремені працюють",
                "fr": "Toutes les ceintures fonctionnent"
              },
              "critical": true
            }
          ]
        }
      ]
    },
    {
      "id": "eng",
      "order": 2,
      "title": {
        "en": "Under the hood",
        "pt": "Compartimento do motor",
        "ru": "Под капотом",
        "uk": "Під капотом",
        "fr": "Sous le capot"
      },
      "children": [
        {
          "id": "eng.fluids",
          "order": 0,
          "title": {
            "en": "Fluids & leaks",
            "pt": "Fluidos e fugas",
            "ru": "Жидкости и потёки",
            "uk": "Рідини та підтікання",
            "fr": "Fluides et fuites"
          },
          "items": [
            {
              "id": "eng.fluids.oil",
              "order": 0,
              "prompt": {
                "en": "Oil level and condition ok",
                "pt": "Nível e estado do óleo ok",
                "ru": "Уровень и состояние масла ок",
                "uk": "Рівень і стан оливи ок",
                "fr": "Niveau et état de l’huile corrects"
              }
            },
            {
              "id": "eng.fluids.leaks",
              "order": 1,
              "prompt": {
                "en": "No visible leaks",
                "pt": "Sem fugas visíveis",
                "ru": "Нет видимых потёков",
                "uk": "Немає видимих підтікань",
                "fr": "Aucune fuite visible"
              },
              "critical": true
            }
          ]
        },
        {
          "id": "eng.belts",
          "order": 1,
          "title": {
            "en": "Belts & mounts",
            "pt": "Correias e apoios",
            "ru": "Ремни и опоры",
            "uk": "Ремені та опори",
            "fr": "Courroies et supports"
          },
          "items": [
            {
              "id": "eng.belts.aux",
              "order": 0,
              "prompt": {
                "en": "Auxiliary belt in good condition",
                "pt": "Correia auxiliar em bom estado",
                "ru": "Приводной ремень в норме",
                "uk": "Привідний ремінь у нормі",
                "fr": "Courroie accessoire en bon état"
              }
            },
            {
              "id": "eng.belts.mounts",
              "order": 1,
              "prompt": {
                "en": "No excess vibration (engine mounts)",
                "pt": "Sem vibração excessiva (apoios do motor)",
                "ru": "Нет лишней вибрации (опоры двигателя)",